{
  "$schema": "../schema/simulator-deployment.schema.json",
  "version": "1",
  "environment": "sepolia",
  "chainId": 11155111,
  "networkName": "sepolia",
  "tokenMode": "mock",
  "tokenAddress": "0x8ffc8CE04789e9a7b53685a2d78CDa54E6Faac15",
  "tokenSymbol": "mUSDC",
  "tokenDecimals": 6,
  "stablecoinVaultSimulatorAddress": "0x32f489842DD515Fa4b4b258714F0067B8B8133ae",
  "verifierAddress": "0x4736138c99e0619D06663D971C8cD347de186F6d",
  "policyEngineAddress": null,
  "timelockAddress": null,
  "recoveryAddress": null,
  "deploymentCommit": "35c25fa294bebea44b3089aa2435a190a5adf3fb",
  "packageVersion": "0.4.24",
  "deployedAt": "2026-06-18T20:23:48.000Z",
  "docsUrl": "https://github.com/Wallet-Wall/walletwall-vault/blob/main/docs/specs/testnet-stablecoin-vault-simulator.md",
  "warnings": [
    "TESTNET ONLY — Ethereum Sepolia. No mainnet deployment exists or is planned.",
    "RESEARCH PROTOTYPE. Not audited. No production security guarantee.",
    "MockUSDC (mUSDC) has no monetary value. There is no purchase path, no custody, and no income-generating product or promised returns.",
    "PQ gate uses MockMLDSAVerifier — structural checks only. No real on-chain ML-DSA cryptographic verification.",
    "No income-generating product or promised returns of any kind.",
    "Explorer source verification is not configured for these addresses. Bytecode reproducibility from the deployment commit HAS been independently confirmed for all three contracts (executable code and, for the simulator, all 8 immutable constructor values) — see deployments/reproducibility/stablecoin-vault-simulator-sepolia.json, mock-usdc-sepolia.json, mock-mldsa-verifier-sepolia.json, and docs/Deployments.md for the exact, explicitly scoped claim.",
    "This metadata is read-only. Metadata presence does not guarantee that the simulator is reachable or ready for production use."
  ]
}
